{
  "agent_name": "Agent6_FAQ",
  "model": "google/gemini-2.5-flash-preview-09-2025",
  "timestamp": "20251003_155254",
  "image_count": 0,
  "temperature": 0.2,
  "system_prompt": "你是安全工程师李师傅，拥有20年安全管理经验。\n\n你的任务：为每个装配步骤添加安全警告（如果该步骤有安全风险）。\n\n## 核心原则\n\n1. **安全第一**：识别所有潜在的安全风险\n2. **嵌入警告**：为有风险的步骤添加safety_warnings字段\n3. **工人友好**：使用通俗语言，避免专业术语\n\n## 输出格式\n\n严格按照以下JSON格式输出（返回增强后的装配步骤）：\n\n```json\n{\n  \"enhanced_steps\": [\n    {\n      \"step_number\": 1,\n      \"title\": \"步骤标题\",\n      \"parts_used\": [...],\n      \"tools_required\": [...],\n      \"operation\": \"操作说明\",\n      \"quality_check\": \"质量检查\",\n      \"estimated_time_minutes\": 10,\n      \"welding\": {...},\n      \"safety_warnings\": [\n        \"佩戴安全帽和防护眼镜\",\n        \"确保工件固定牢固\",\n        \"注意防止烫伤\"\n      ]\n    }\n  ]\n}\n```\n\n**⚠️ 重要**：\n- 如果步骤没有安全风险，不要添加safety_warnings字段\n- 如果步骤有安全风险，safety_warnings必须是字符串数组\n- 保持原有步骤的所有字段不变，只添加safety_warnings字段\n\n## 重要提醒\n\n- **只输出JSON，不要输出其他内容**\n- **安全警告要具体**：说明具体的风险和预防措施\n- **使用通俗语言**：工人能看懂的语言\n",
  "user_query": "请为以下装配步骤添加安全警告（如果有安全风险）。\n\n## 装配步骤\n\n[\n  {\n    \"step_number\": 1,\n    \"title\": \"基准件定位\",\n    \"parts_used\": [\n      {\n        \"bom_code\": \"01.01.01.11509\",\n        \"bom_name\": \"连接板 1\",\n        \"quantity\": 1,\n        \"mesh_id\": [\n          \"mesh_018\"\n        ]\n      }\n    ],\n    \"tools_required\": [\n      \"装配平台\",\n      \"定位夹具\"\n    ],\n    \"operation\": \"将基准件上连接板（01.01.01.11509）放置在装配平台上，使用定位夹具将其固定，确保其水平和初始位置准确。\",\n    \"quality_check\": \"检查连接板是否平稳，定位尺寸是否符合图纸要求（特别是孔位）。\",\n    \"estimated_time_minutes\": 5\n  },\n  {\n    \"step_number\": 2,\n    \"title\": \"安装主矩形管\",\n    \"parts_used\": [\n      {\n        \"bom_code\": \"01.01.03.2718\",\n        \"bom_name\": \"矩形管 1\",\n        \"quantity\": 1,\n        \"mesh_id\": [\n          \"mesh_019\"\n        ]\n      }\n    ],\n    \"tools_required\": [\n      \"卷尺\",\n      \"角尺\",\n      \"点焊机\"\n    ],\n    \"operation\": \"将矩形管 1 (01.01.03.2718) 垂直放置在连接板 (01.01.01.11509) 的指定位置上。使用角尺确保矩形管与连接板垂直，然后进行点焊固定。\",\n    \"quality_check\": \"检查矩形管的垂直度，点焊位置应牢固，无虚焊。\",\n    \"estimated_time_minutes\": 8,\n    \"welding\": {\n      \"required\": true,\n      \"welding_type\": \"点焊（定位焊）\",\n      \"welding_method\": \"CO2气保焊\",\n      \"weld_size\": \"点焊长度10-15mm，每侧2点\",\n      \"welding_position\": \"矩形管底部与连接板的连接处\",\n      \"quality_requirements\": \"焊点牢固，能承受后续装配应力，不影响最终焊缝质量。\",\n      \"safety_notes\": \"点焊时注意佩戴防护眼镜和手套，防止电弧光和飞溅物伤害。\"\n    }\n  },\n  {\n    \"step_number\": 3,\n    \"title\": \"安装侧面矩形管\",\n    \"parts_used\": [\n      {\n        \"bom_code\": \"01.01.03.2719\",\n        \"bom_name\": \"矩形管 2\",\n        \"quantity\": 2,\n        \"mesh_id\": [\n          \"mesh_006\",\n          \"mesh_007\"\n        ]\n      }\n    ],\n    \"tools_required\": [\n      \"卷尺\",\n      \"磁力夹具\",\n      \"点焊机\"\n    ],\n    \"operation\": \"将两根矩形管 2 (01.01.03.2719) 分别安装在主矩形管两侧的指定位置，形成框架结构。使用磁力夹具辅助定位，确保尺寸和角度正确后进行点焊固定。\",\n    \"quality_check\": \"检查两根矩形管 2 的对称性，以及与主矩形管的连接间隙。\",\n    \"estimated_time_minutes\": 10,\n    \"welding\": {\n      \"required\": true,\n      \"welding_type\": \"点焊（定位焊）\",\n      \"welding_method\": \"CO2气保焊\",\n      \"weld_size\": \"点焊长度10-15mm，每条边2点\",\n      \"welding_position\": \"矩形管 2 与矩形管 1 的连接角部\",\n      \"quality_requirements\": \"焊点位置准确，保证框架结构稳定，无明显变形。\",\n      \"safety_notes\": \"确保工件接地良好，避免触电风险。点焊区域保持清洁。\"\n    }\n  },\n  {\n    \"step_number\": 4,\n    \"title\": \"安装加强筋和封板\",\n    \"parts_used\": [\n      {\n        \"bom_code\": \"01.01.01.17678\",\n        \"bom_name\": \"加强筋 2\",\n        \"quantity\": 2,\n        \"mesh_id\": [\n          \"mesh_001\"\n        ]\n      },\n      {\n        \"bom_code\": \"01.01.01.16608\",\n        \"bom_name\": \"封板 2\",\n        \"quantity\": 2,\n        \"mesh_id\": [\n          \"mesh_004\"\n        ]\n      }\n    ],\n    \"tools_required\": [\n      \"点焊机\"\n    ],\n    \"operation\": \"将两块封板 (01.01.01.16608) 安装在框架的两端开口处，并点焊固定。然后将两根加强筋 (01.01.01.17678) 安装在框架内部的斜撑位置，点焊固定。\",\n    \"quality_check\": \"检查封板是否完全覆盖开口，加强筋是否紧密贴合，点焊牢固。\",\n    \"estimated_time_minutes\": 12,\n    \"welding\": {\n      \"required\": true,\n      \"welding_type\": \"点焊（定位焊）\",\n      \"welding_method\": \"CO2气保焊\",\n      \"weld_size\": \"点焊长度10mm，每块板/筋至少3点\",\n      \"welding_position\": \"封板边缘与矩形管接触处；加强筋与矩形管接触处\",\n      \"quality_requirements\": \"定位准确，保证后续满焊时零件位置不移动。\",\n      \"safety_notes\": \"加强筋和封板通常较薄，点焊时注意控制电流，避免烧穿。\"\n    }\n  },\n  {\n    \"step_number\": 5,\n    \"title\": \"安装顶部矩形管\",\n    \"parts_used\": [\n      {\n        \"bom_code\": \"01.01.03.2720\",\n        \"bom_name\": \"矩形管 1\",\n        \"quantity\": 1,\n        \"mesh_id\": [\n          \"mesh_003\"\n        ]\n      }\n    ],\n    \"tools_required\": [\n      \"卷尺\",\n      \"水平仪\",\n      \"点焊机\"\n    ],\n    \"operation\": \"将矩形管 1 (01.01.03.2720) 安装在框架结构的顶部，与两侧的矩形管 2 对齐。使用水平仪确保顶部水平，然后进行点焊固定。\",\n    \"quality_check\": \"检查顶部矩形管的水平度，以及与下方结构的对齐情况。\",\n    \"estimated_time_minutes\": 7,\n    \"welding\": {\n      \"required\": true,\n      \"welding_type\": \"点焊（定位焊）\",\n      \"welding_method\": \"CO2气保焊\",\n      \"weld_size\": \"点焊长度10-15mm，每个连接角2点\",\n      \"welding_position\": \"顶部矩形管与侧面矩形管的连接角部\",\n      \"quality_requirements\": \"确保顶部水平度，焊点牢固，为后续满焊做准备。\",\n      \"safety_notes\": \"高处作业（如果适用）需注意防坠落，并确保焊接区域无易燃物。\"\n    }\n  },\n  {\n    \"step_number\": 6,\n    \"title\": \"安装方形板\",\n    \"parts_used\": [\n      {\n        \"bom_code\": \"01.01.01.6589\",\n        \"bom_name\": \"方形板-机加 4\",\n        \"quantity\": 4,\n        \"mesh_id\": [\n          \"mesh_014\"\n        ]\n      }\n    ],\n    \"tools_required\": [\n      \"定位工装\",\n      \"点焊机\"\n    ],\n    \"operation\": \"将四块方形板 (01.01.01.6589) 按照图纸要求，安装在框架结构上的指定位置（通常用于连接其他部件或作为加强支撑）。使用定位工装确保位置准确，然后点焊固定。\",\n    \"quality_check\": \"检查方形板的安装位置和方向是否正确，点焊是否均匀。\",\n    \"estimated_time_minutes\": 10,\n    \"welding\": {\n      \"required\": true,\n      \"welding_type\": \"点焊（定位焊）\",\n      \"welding_method\": \"CO2气保焊\",\n      \"weld_size\": \"点焊长度8-10mm，每块板至少4点\",\n      \"welding_position\": \"方形板边缘与矩形管接触处\",\n      \"quality_requirements\": \"焊点均匀分布，保证方形板与主体结构紧密贴合。\",\n      \"safety_notes\": \"方形板通常有加工面，点焊时注意保护加工面，避免飞溅损伤。\"\n    }\n  },\n  {\n    \"step_number\": 7,\n    \"title\": \"安装挂件虚拟组件\",\n    \"parts_used\": [\n      {\n        \"bom_code\": \"01.05.0019\",\n        \"bom_name\": \"左挂件虚拟组件 1\",\n        \"quantity\": 1,\n        \"mesh_id\": [\n          \"mesh_009\"\n        ]\n      },\n      {\n        \"bom_code\": \"01.05.0018\",\n        \"bom_name\": \"右挂件虚拟组件 1\",\n        \"quantity\": 1,\n        \"mesh_id\": [\n          \"mesh_010\"\n        ]\n      }\n    ],\n    \"tools_required\": [\n      \"定位工装\",\n      \"点焊机\"\n    ],\n    \"operation\": \"将左挂件虚拟组件 (01.05.0019) 和右挂件虚拟组件 (01.05.0018) 分别安装在框架结构的两端，确保挂件的中心线与主体结构对齐。使用定位工装固定后进行点焊。\",\n    \"quality_check\": \"检查左右挂件的相对位置和角度，确保对称性符合要求。\",\n    \"estimated_time_minutes\": 15,\n    \"welding\": {\n      \"required\": true,\n      \"welding_type\": \"点焊（定位焊）\",\n      \"welding_method\": \"CO2气保焊\",\n      \"weld_size\": \"点焊长度15mm，每个挂件至少4点\",\n      \"welding_position\": \"挂件与主体矩形管的连接面\",\n      \"quality_requirements\": \"挂件定位精度要求高，点焊必须牢固，防止后续焊接时位移。\",\n      \"safety_notes\": \"挂件通常较重，安装和点焊时注意支撑，防止倾倒或砸伤。\"\n    }\n  },\n  {\n    \"step_number\": 8,\n    \"title\": \"整体焊接与校正\",\n    \"parts_used\": [],\n    \"tools_required\": [\n      \"焊机\",\n      \"焊枪\",\n      \"角磨机\",\n      \"校正平台\"\n    ],\n    \"operation\": \"对所有点焊部位进行全面焊接，确保焊缝饱满、牢固。焊接完成后，使用角磨机清理焊渣和飞溅。将组件放置在校正平台上，检查整体尺寸和形位公差，必要时进行校正。\",\n    \"quality_check\": \"检查所有焊缝是否符合技术要求（无虚焊、漏焊、裂纹），整体尺寸公差和平面度是否在允许范围内。\",\n    \"estimated_time_minutes\": 30,\n    \"welding\": {\n      \"required\": true,\n      \"welding_type\": \"角焊/搭接焊（满焊）\",\n      \"welding_method\": \"CO2气保焊\",\n      \"weld_size\": \"焊脚高度6mm（或按图纸要求），连续焊缝\",\n      \"welding_position\": \"所有零件连接处（矩形管与连接板、矩形管与矩形管、板与管）\",\n      \"quality_requirements\": \"焊缝必须连续、均匀、饱满，无气孔、夹渣、裂纹等缺陷。焊后清理干净，无焊渣飞溅残留。\",\n      \"safety_notes\": \"进行满焊时，必须佩戴全套防护装备（焊接面罩、防火服、手套）。注意控制焊接变形，采用分段、对称焊接，避免热量集中。确保工作区域通风良好，防止烟尘危害。\"\n    }\n  }\n]\n\n## 要求\n\n1. **识别风险步骤**：判断哪些步骤有安全风险（吊装、焊接、高空作业、重物搬运等）\n2. **添加安全警告**：为有风险的步骤添加safety_warnings字段\n3. **保持原有字段**：不要修改或删除原有的字段（step_number、title、welding等）\n4. **使用通俗语言**：工人能看懂的语言\n5. **警告要具体**：说明具体的风险和预防措施\n\n## 自检清单\n\n- [ ] 所有有风险的步骤都添加了safety_warnings字段\n- [ ] safety_warnings是字符串数组，每条警告简洁明了\n- [ ] 原有步骤的所有字段都保持不变\n- [ ] 没有风险的步骤没有添加safety_warnings字段\n\n现在开始为装配步骤添加安全警告！\n",
  "raw_response": "```json\n{\n  \"enhanced_steps\": [\n    {\n      \"step_number\": 1,\n      \"title\": \"基准件定位\",\n      \"parts_used\": [\n        {\n          \"bom_code\": \"01.01.01.11509\",\n          \"bom_name\": \"连接板 1\",\n          \"quantity\": 1,\n          \"mesh_id\": [\n            \"mesh_018\"\n          ]\n        }\n      ],\n      \"tools_required\": [\n        \"装配平台\",\n        \"定位夹具\"\n      ],\n      \"operation\": \"将基准件上连接板（01.01.01.11509）放置在装配平台上，使用定位夹具将其固定，确保其水平和初始位置准确。\",\n      \"quality_check\": \"检查连接板是否平稳，定位尺寸是否符合图纸要求（特别是孔位）。\",\n      \"estimated_time_minutes\": 5\n    },\n    {\n      \"step_number\": 2,\n      \"title\": \"安装主矩形管\",\n      \"parts_used\": [\n        {\n          \"bom_code\": \"01.01.03.2718\",\n          \"bom_name\": \"矩形管 1\",\n          \"quantity\": 1,\n          \"mesh_id\": [\n            \"mesh_019\"\n          ]\n        }\n      ],\n      \"tools_required\": [\n        \"卷尺\",\n        \"角尺\",\n        \"点焊机\"\n      ],\n      \"operation\": \"将矩形管 1 (01.01.03.2718) 垂直放置在连接板 (01.01.01.11509) 的指定位置上。使用角尺确保矩形管与连接板垂直，然后进行点焊固定。\",\n      \"quality_check\": \"检查矩形管的垂直度，点焊位置应牢固，无虚焊。\",\n      \"estimated_time_minutes\": 8,\n      \"welding\": {\n        \"required\": true,\n        \"welding_type\": \"点焊（定位焊）\",\n        \"welding_method\": \"CO2气保焊\",\n        \"weld_size\": \"点焊长度10-15mm，每侧2点\",\n        \"welding_position\": \"矩形管底部与连接板的连接处\",\n        \"quality_requirements\": \"焊点牢固，能承受后续装配应力，不影响最终焊缝质量。\",\n        \"safety_notes\": \"点焊时注意佩戴防护眼镜和手套，防止电弧光和飞溅物伤害。\"\n      },\n      \"safety_warnings\": [\n        \"进行点焊作业时，必须佩戴焊接面罩、防护手套和防护服，防止电弧光灼伤眼睛和皮肤。\",\n        \"确保工件放置稳固，防止矩形管倾倒砸伤。\",\n        \"点焊区域应保持干燥和通风。\"\n      ]\n    },\n    {\n      \"step_number\": 3,\n      \"title\": \"安装侧面矩形管\",\n      \"parts_used\": [\n        {\n          \"bom_code\": \"01.01.03.2719\",\n          \"bom_name\": \"矩形管 2\",\n          \"quantity\": 2,\n          \"mesh_id\": [\n            \"mesh_006\",\n            \"mesh_007\"\n          ]\n        }\n      ],\n      \"tools_required\": [\n        \"卷尺\",\n        \"磁力夹具\",\n        \"点焊机\"\n      ],\n      \"operation\": \"将两根矩形管 2 (01.01.03.2719) 分别安装在主矩形管两侧的指定位置，形成框架结构。使用磁力夹具辅助定位，确保尺寸和角度正确后进行点焊固定。\",\n      \"quality_check\": \"检查两根矩形管 2 的对称性，以及与主矩形管的连接间隙。\",\n      \"estimated_time_minutes\": 10,\n      \"welding\": {\n        \"required\": true,\n        \"welding_type\": \"点焊（定位焊）\",\n        \"welding_method\": \"CO2气保焊\",\n        \"weld_size\": \"点焊长度10-15mm，每条边2点\",\n        \"welding_position\": \"矩形管 2 与矩形管 1 的连接角部\",\n        \"quality_requirements\": \"焊点位置准确，保证框架结构稳定，无明显变形。\",\n        \"safety_notes\": \"确保工件接地良好，避免触电风险。点焊区域保持清洁。\"\n      },\n      \"safety_warnings\": [\n        \"使用磁力夹具时，注意夹具吸力，防止夹手。\",\n        \"点焊时，务必佩戴防护用品，防止电弧光和金属飞溅物伤害。\",\n        \"确保点焊机接地良好，避免触电。\"\n      ]\n    },\n    {\n      \"step_number\": 4,\n      \"title\": \"安装加强筋和封板\",\n      \"parts_used\": [\n        {\n          \"bom_code\": \"01.01.01.17678\",\n          \"bom_name\": \"加强筋 2\",\n          \"quantity\": 2,\n          \"mesh_id\": [\n            \"mesh_001\"\n          ]\n        },\n        {\n          \"bom_code\": \"01.01.01.16608\",\n          \"bom_name\": \"封板 2\",\n          \"quantity\": 2,\n          \"mesh_id\": [\n            \"mesh_004\"\n          ]\n        }\n      ],\n      \"tools_required\": [\n        \"点焊机\"\n      ],\n      \"operation\": \"将两块封板 (01.01.01.16608) 安装在框架的两端开口处，并点焊固定。然后将两根加强筋 (01.01.01.17678) 安装在框架内部的斜撑位置，点焊固定。\",\n      \"quality_check\": \"检查封板是否完全覆盖开口，加强筋是否紧密贴合，点焊牢固。\",\n      \"estimated_time_minutes\": 12,\n      \"welding\": {\n        \"required\": true,\n        \"welding_type\": \"点焊（定位焊）\",\n        \"welding_method\": \"CO2气保焊\",\n        \"weld_size\": \"点焊长度10mm，每块板/筋至少3点\",\n        \"welding_position\": \"封板边缘与矩形管接触处；加强筋与矩形管接触处\",\n        \"quality_requirements\": \"定位准确，保证后续满焊时零件位置不移动。\",\n        \"safety_notes\": \"加强筋和封板通常较薄，点焊时注意控制电流，避免烧穿。\"\n      },\n      \"safety_warnings\": [\n        \"点焊薄板时，注意控制焊接时间，防止烧穿或烫伤。\",\n        \"佩戴好焊接防护用品，防止焊接烟尘吸入和飞溅物伤害。\"\n      ]\n    },\n    {\n      \"step_number\": 5,\n      \"title\": \"安装顶部矩形管\",\n      \"parts_used\": [\n        {\n          \"bom_code\": \"01.01.03.2720\",\n          \"bom_name\": \"矩形管 1\",\n          \"quantity\": 1,\n          \"mesh_id\": [\n            \"mesh_003\"\n          ]\n        }\n      ],\n      \"tools_required\": [\n        \"卷尺\",\n        \"水平仪\",\n        \"点焊机\"\n      ],\n      \"operation\": \"将矩形管 1 (01.01.03.2720) 安装在框架结构的顶部，与两侧的矩形管 2 对齐。使用水平仪确保顶部水平，然后进行点焊固定。\",\n      \"quality_check\": \"检查顶部矩形管的水平度，以及与下方结构的对齐情况。\",\n      \"estimated_time_minutes\": 7,\n      \"welding\": {\n        \"required\": true,\n        \"welding_type\": \"点焊（定位焊）\",\n        \"welting_method\": \"CO2气保焊\",\n        \"weld_size\": \"点焊长度10-15mm，每个连接角2点\",\n        \"welding_position\": \"顶部矩形管与侧面矩形管的连接角部\",\n        \"quality_requirements\": \"确保顶部水平度，焊点牢固，为后续满焊做准备。\",\n        \"safety_notes\": \"高处作业（如果适用）需注意防坠落，并确保焊接区域无易燃物。\"\n      },\n      \"safety_warnings\": [\n        \"如果装配高度较高，操作人员必须使用稳固的梯子或平台，并注意防坠落。\",\n        \"搬运顶部矩形管时，注意重心，防止部件滑落砸伤脚部。\",\n        \"焊接时，确保周围没有易燃易爆物品。\"\n      ]\n    },\n    {\n      \"step_number\": 6,\n      \"title\": \"安装方形板\",\n      \"parts_used\": [\n        {\n          \"bom_code\": \"01.01.01.6589\",\n          \"bom_name\": \"方形板-机加 4\",\n          \"quantity\": 4,\n          \"mesh_id\": [\n            \"mesh_014\"\n          ]\n        }\n      ],\n      \"tools_required\": [\n        \"定位工装\",\n        \"点焊机\"\n      ],\n      \"operation\": \"将四块方形板 (01.01.01.6589) 按照图纸要求，安装在框架结构上的指定位置（通常用于连接其他部件或作为加强支撑）。使用定位工装确保位置准确，然后点焊固定。\",\n      \"quality_check\": \"检查方形板的安装位置和方向是否正确，点焊是否均匀。\",\n      \"estimated_time_minutes\": 10,\n      \"welding\": {\n        \"required\": true,\n        \"welding_type\": \"点焊（定位焊）\",\n        \"welding_method\": \"CO2气保焊\",\n        \"weld_size\": \"点焊长度8-10mm，每块板至少4点\",\n        \"welding_position\": \"方形板边缘与矩形管接触处\",\n        \"quality_requirements\": \"焊点均匀分布，保证方形板与主体结构紧密贴合。\",\n        \"safety_notes\": \"方形板通常有加工面，点焊时注意保护加工面，避免飞溅损伤。\"\n      },\n      \"safety_warnings\": [\n        \"点焊时注意保护工件的精密加工面，防止焊渣飞溅造成损伤。\",\n        \"操作定位工装时，注意夹紧和松开时的动作，防止夹伤手指。\"\n      ]\n    },\n    {\n      \"step_number\": 7,\n      \"title\": \"安装挂件虚拟组件\",\n      \"parts_used\": [\n        {\n          \"bom_code\": \"01.05.0019\",\n          \"bom_name\": \"左挂件虚拟组件 1\",\n          \"quantity\": 1,\n          \"mesh_id\": [\n            \"mesh_009\"\n          ]\n        },\n        {\n          \"bom_code\": \"01.05.0018\",\n          \"bom_name\": \"右挂件虚拟组件 1\",\n          \"quantity\": 1,\n          \"mesh_id\": [\n            \"mesh_010\"\n          ]\n        }\n      ],\n      \"tools_required\": [\n        \"定位工装\",\n        \"点焊机\"\n      ],\n      \"operation\": \"将左挂件虚拟组件 (01.05.0019) 和右挂件虚拟组件 (01.05.0018) 分别安装在框架结构的两端，确保挂件的中心线与主体结构对齐。使用定位工装固定后进行点焊。\",\n      \"quality_check\": \"检查左右挂件的相对位置和角度，确保对称性符合要求。\",\n      \"estimated_time_minutes\": 15,\n      \"welding\": {\n        \"required\": true,\n        \"welding_type\": \"点焊（定位焊）\",\n        \"welding_method\": \"CO2气保焊\",\n        \"weld_size\": \"点焊长度15mm，每个挂件至少4点\",\n        \"welding_position\": \"挂件与主体矩形管的连接面\",\n        \"quality_requirements\": \"挂件定位精度要求高，点焊必须牢固，防止后续焊接时位移。\",\n        \"safety_notes\": \"挂件通常较重，安装和点焊时注意支撑，防止倾倒或砸伤。\"\n      },\n      \"safety_warnings\": [\n        \"挂件组件可能较重，搬运时应使用合适的吊具或两人协作，防止扭伤或砸伤。\",\n        \"安装和点焊时，确保挂件组件有可靠的支撑，防止突然倾倒造成人员伤害或设备损坏。\",\n        \"点焊操作严格遵守焊接安全规程。\"\n      ]\n    },\n    {\n      \"step_number\": 8,\n      \"title\": \"整体焊接与校正\",\n      \"parts_used\": [],\n      \"tools_required\": [\n        \"焊机\",\n        \"焊枪\",\n        \"角磨机\",\n        \"校正平台\"\n      ],\n      \"operation\": \"对所有点焊部位进行全面焊接，确保焊缝饱满、牢固。焊接完成后，使用角磨机清理焊渣和飞溅。将组件放置在校正平台上，检查整体尺寸和形位公差，必要时进行校正。\",\n      \"quality_check\": \"检查所有焊缝是否符合技术要求（无虚焊、漏焊、裂纹），整体尺寸公差和平面度是否在允许范围内。\",\n      \"estimated_time_minutes\": 30,\n      \"welding\": {\n        \"required\": true,\n        \"welding_type\": \"角焊/搭接焊（满焊）\",\n        \"welding_method\": \"CO2气保焊\",\n        \"weld_size\": \"焊脚高度6mm（或按图纸要求），连续焊缝\",\n        \"welding_position\": \"所有零件连接处（矩形管与连接板、矩形管与矩形管、板与管）\",\n        \"quality_requirements\": \"焊缝必须连续、均匀、饱满，无气孔、夹渣、裂纹等缺陷。焊后清理干净，无焊渣飞溅残留。\",\n        \"safety_notes\": \"进行满焊时，必须佩戴全套防护装备（焊接面罩、防火服、手套）。注意控制焊接变形，采用分段、对称焊接，避免热量集中。确保工作区域通风良好，防止烟尘危害。\"\n      },\n      \"safety_warnings\": [\n        \"满焊时必须佩戴全套焊接防护用品（面罩、防火服、手套），防止强光、高温和飞溅物伤害。\",\n        \"确保工作区域通风良好，使用排烟设备，防止吸入有害焊接烟尘。\",\n        \"使用角磨机清理焊渣时，必须佩戴防护眼镜和耳塞，防止飞溅物伤眼和噪音损伤听力。\",\n        \"刚焊接完的工件温度很高，搬运或触摸时必须戴隔热手套，防止烫伤。\"\n      ]\n    }\n  ]\n}\n```",
  "parsed_result": {
    "enhanced_steps": [
      {
        "step_number": 1,
        "title": "基准件定位",
        "parts_used": [
          {
            "bom_code": "01.01.01.11509",
            "bom_name": "连接板 1",
            "quantity": 1,
            "mesh_id": [
              "mesh_018"
            ]
          }
        ],
        "tools_required": [
          "装配平台",
          "定位夹具"
        ],
        "operation": "将基准件上连接板（01.01.01.11509）放置在装配平台上，使用定位夹具将其固定，确保其水平和初始位置准确。",
        "quality_check": "检查连接板是否平稳，定位尺寸是否符合图纸要求（特别是孔位）。",
        "estimated_time_minutes": 5
      },
      {
        "step_number": 2,
        "title": "安装主矩形管",
        "parts_used": [
          {
            "bom_code": "01.01.03.2718",
            "bom_name": "矩形管 1",
            "quantity": 1,
            "mesh_id": [
              "mesh_019"
            ]
          }
        ],
        "tools_required": [
          "卷尺",
          "角尺",
          "点焊机"
        ],
        "operation": "将矩形管 1 (01.01.03.2718) 垂直放置在连接板 (01.01.01.11509) 的指定位置上。使用角尺确保矩形管与连接板垂直，然后进行点焊固定。",
        "quality_check": "检查矩形管的垂直度，点焊位置应牢固，无虚焊。",
        "estimated_time_minutes": 8,
        "welding": {
          "required": true,
          "welding_type": "点焊（定位焊）",
          "welding_method": "CO2气保焊",
          "weld_size": "点焊长度10-15mm，每侧2点",
          "welding_position": "矩形管底部与连接板的连接处",
          "quality_requirements": "焊点牢固，能承受后续装配应力，不影响最终焊缝质量。",
          "safety_notes": "点焊时注意佩戴防护眼镜和手套，防止电弧光和飞溅物伤害。"
        },
        "safety_warnings": [
          "进行点焊作业时，必须佩戴焊接面罩、防护手套和防护服，防止电弧光灼伤眼睛和皮肤。",
          "确保工件放置稳固，防止矩形管倾倒砸伤。",
          "点焊区域应保持干燥和通风。"
        ]
      },
      {
        "step_number": 3,
        "title": "安装侧面矩形管",
        "parts_used": [
          {
            "bom_code": "01.01.03.2719",
            "bom_name": "矩形管 2",
            "quantity": 2,
            "mesh_id": [
              "mesh_006",
              "mesh_007"
            ]
          }
        ],
        "tools_required": [
          "卷尺",
          "磁力夹具",
          "点焊机"
        ],
        "operation": "将两根矩形管 2 (01.01.03.2719) 分别安装在主矩形管两侧的指定位置，形成框架结构。使用磁力夹具辅助定位，确保尺寸和角度正确后进行点焊固定。",
        "quality_check": "检查两根矩形管 2 的对称性，以及与主矩形管的连接间隙。",
        "estimated_time_minutes": 10,
        "welding": {
          "required": true,
          "welding_type": "点焊（定位焊）",
          "welding_method": "CO2气保焊",
          "weld_size": "点焊长度10-15mm，每条边2点",
          "welding_position": "矩形管 2 与矩形管 1 的连接角部",
          "quality_requirements": "焊点位置准确，保证框架结构稳定，无明显变形。",
          "safety_notes": "确保工件接地良好，避免触电风险。点焊区域保持清洁。"
        },
        "safety_warnings": [
          "使用磁力夹具时，注意夹具吸力，防止夹手。",
          "点焊时，务必佩戴防护用品，防止电弧光和金属飞溅物伤害。",
          "确保点焊机接地良好，避免触电。"
        ]
      },
      {
        "step_number": 4,
        "title": "安装加强筋和封板",
        "parts_used": [
          {
            "bom_code": "01.01.01.17678",
            "bom_name": "加强筋 2",
            "quantity": 2,
            "mesh_id": [
              "mesh_001"
            ]
          },
          {
            "bom_code": "01.01.01.16608",
            "bom_name": "封板 2",
            "quantity": 2,
            "mesh_id": [
              "mesh_004"
            ]
          }
        ],
        "tools_required": [
          "点焊机"
        ],
        "operation": "将两块封板 (01.01.01.16608) 安装在框架的两端开口处，并点焊固定。然后将两根加强筋 (01.01.01.17678) 安装在框架内部的斜撑位置，点焊固定。",
        "quality_check": "检查封板是否完全覆盖开口，加强筋是否紧密贴合，点焊牢固。",
        "estimated_time_minutes": 12,
        "welding": {
          "required": true,
          "welding_type": "点焊（定位焊）",
          "welding_method": "CO2气保焊",
          "weld_size": "点焊长度10mm，每块板/筋至少3点",
          "welding_position": "封板边缘与矩形管接触处；加强筋与矩形管接触处",
          "quality_requirements": "定位准确，保证后续满焊时零件位置不移动。",
          "safety_notes": "加强筋和封板通常较薄，点焊时注意控制电流，避免烧穿。"
        },
        "safety_warnings": [
          "点焊薄板时，注意控制焊接时间，防止烧穿或烫伤。",
          "佩戴好焊接防护用品，防止焊接烟尘吸入和飞溅物伤害。"
        ]
      },
      {
        "step_number": 5,
        "title": "安装顶部矩形管",
        "parts_used": [
          {
            "bom_code": "01.01.03.2720",
            "bom_name": "矩形管 1",
            "quantity": 1,
            "mesh_id": [
              "mesh_003"
            ]
          }
        ],
        "tools_required": [
          "卷尺",
          "水平仪",
          "点焊机"
        ],
        "operation": "将矩形管 1 (01.01.03.2720) 安装在框架结构的顶部，与两侧的矩形管 2 对齐。使用水平仪确保顶部水平，然后进行点焊固定。",
        "quality_check": "检查顶部矩形管的水平度，以及与下方结构的对齐情况。",
        "estimated_time_minutes": 7,
        "welding": {
          "required": true,
          "welding_type": "点焊（定位焊）",
          "welting_method": "CO2气保焊",
          "weld_size": "点焊长度10-15mm，每个连接角2点",
          "welding_position": "顶部矩形管与侧面矩形管的连接角部",
          "quality_requirements": "确保顶部水平度，焊点牢固，为后续满焊做准备。",
          "safety_notes": "高处作业（如果适用）需注意防坠落，并确保焊接区域无易燃物。"
        },
        "safety_warnings": [
          "如果装配高度较高，操作人员必须使用稳固的梯子或平台，并注意防坠落。",
          "搬运顶部矩形管时，注意重心，防止部件滑落砸伤脚部。",
          "焊接时，确保周围没有易燃易爆物品。"
        ]
      },
      {
        "step_number": 6,
        "title": "安装方形板",
        "parts_used": [
          {
            "bom_code": "01.01.01.6589",
            "bom_name": "方形板-机加 4",
            "quantity": 4,
            "mesh_id": [
              "mesh_014"
            ]
          }
        ],
        "tools_required": [
          "定位工装",
          "点焊机"
        ],
        "operation": "将四块方形板 (01.01.01.6589) 按照图纸要求，安装在框架结构上的指定位置（通常用于连接其他部件或作为加强支撑）。使用定位工装确保位置准确，然后点焊固定。",
        "quality_check": "检查方形板的安装位置和方向是否正确，点焊是否均匀。",
        "estimated_time_minutes": 10,
        "welding": {
          "required": true,
          "welding_type": "点焊（定位焊）",
          "welding_method": "CO2气保焊",
          "weld_size": "点焊长度8-10mm，每块板至少4点",
          "welding_position": "方形板边缘与矩形管接触处",
          "quality_requirements": "焊点均匀分布，保证方形板与主体结构紧密贴合。",
          "safety_notes": "方形板通常有加工面，点焊时注意保护加工面，避免飞溅损伤。"
        },
        "safety_warnings": [
          "点焊时注意保护工件的精密加工面，防止焊渣飞溅造成损伤。",
          "操作定位工装时，注意夹紧和松开时的动作，防止夹伤手指。"
        ]
      },
      {
        "step_number": 7,
        "title": "安装挂件虚拟组件",
        "parts_used": [
          {
            "bom_code": "01.05.0019",
            "bom_name": "左挂件虚拟组件 1",
            "quantity": 1,
            "mesh_id": [
              "mesh_009"
            ]
          },
          {
            "bom_code": "01.05.0018",
            "bom_name": "右挂件虚拟组件 1",
            "quantity": 1,
            "mesh_id": [
              "mesh_010"
            ]
          }
        ],
        "tools_required": [
          "定位工装",
          "点焊机"
        ],
        "operation": "将左挂件虚拟组件 (01.05.0019) 和右挂件虚拟组件 (01.05.0018) 分别安装在框架结构的两端，确保挂件的中心线与主体结构对齐。使用定位工装固定后进行点焊。",
        "quality_check": "检查左右挂件的相对位置和角度，确保对称性符合要求。",
        "estimated_time_minutes": 15,
        "welding": {
          "required": true,
          "welding_type": "点焊（定位焊）",
          "welding_method": "CO2气保焊",
          "weld_size": "点焊长度15mm，每个挂件至少4点",
          "welding_position": "挂件与主体矩形管的连接面",
          "quality_requirements": "挂件定位精度要求高，点焊必须牢固，防止后续焊接时位移。",
          "safety_notes": "挂件通常较重，安装和点焊时注意支撑，防止倾倒或砸伤。"
        },
        "safety_warnings": [
          "挂件组件可能较重，搬运时应使用合适的吊具或两人协作，防止扭伤或砸伤。",
          "安装和点焊时，确保挂件组件有可靠的支撑，防止突然倾倒造成人员伤害或设备损坏。",
          "点焊操作严格遵守焊接安全规程。"
        ]
      },
      {
        "step_number": 8,
        "title": "整体焊接与校正",
        "parts_used": [],
        "tools_required": [
          "焊机",
          "焊枪",
          "角磨机",
          "校正平台"
        ],
        "operation": "对所有点焊部位进行全面焊接，确保焊缝饱满、牢固。焊接完成后，使用角磨机清理焊渣和飞溅。将组件放置在校正平台上，检查整体尺寸和形位公差，必要时进行校正。",
        "quality_check": "检查所有焊缝是否符合技术要求（无虚焊、漏焊、裂纹），整体尺寸公差和平面度是否在允许范围内。",
        "estimated_time_minutes": 30,
        "welding": {
          "required": true,
          "welding_type": "角焊/搭接焊（满焊）",
          "welding_method": "CO2气保焊",
          "weld_size": "焊脚高度6mm（或按图纸要求），连续焊缝",
          "welding_position": "所有零件连接处（矩形管与连接板、矩形管与矩形管、板与管）",
          "quality_requirements": "焊缝必须连续、均匀、饱满，无气孔、夹渣、裂纹等缺陷。焊后清理干净，无焊渣飞溅残留。",
          "safety_notes": "进行满焊时，必须佩戴全套防护装备（焊接面罩、防火服、手套）。注意控制焊接变形，采用分段、对称焊接，避免热量集中。确保工作区域通风良好，防止烟尘危害。"
        },
        "safety_warnings": [
          "满焊时必须佩戴全套焊接防护用品（面罩、防火服、手套），防止强光、高温和飞溅物伤害。",
          "确保工作区域通风良好，使用排烟设备，防止吸入有害焊接烟尘。",
          "使用角磨机清理焊渣时，必须佩戴防护眼镜和耳塞，防止飞溅物伤眼和噪音损伤听力。",
          "刚焊接完的工件温度很高，搬运或触摸时必须戴隔热手套，防止烫伤。"
        ]
      }
    ]
  }
}