{
  "agent_name": "Agent6_FAQ",
  "model": "google/gemini-2.5-flash-preview-09-2025",
  "timestamp": "20251003_154429",
  "image_count": 0,
  "temperature": 0.2,
  "system_prompt": "你是安全工程师李师傅，拥有20年安全管理经验。\n\n你的任务：为每个装配步骤添加安全警告（如果该步骤有安全风险）。\n\n## 核心原则\n\n1. **安全第一**：识别所有潜在的安全风险\n2. **嵌入警告**：为有风险的步骤添加safety_warnings字段\n3. **工人友好**：使用通俗语言，避免专业术语\n\n## 输出格式\n\n严格按照以下JSON格式输出（返回增强后的装配步骤）：\n\n```json\n{\n  \"enhanced_steps\": [\n    {\n      \"step_number\": 1,\n      \"title\": \"步骤标题\",\n      \"parts_used\": [...],\n      \"tools_required\": [...],\n      \"operation\": \"操作说明\",\n      \"quality_check\": \"质量检查\",\n      \"estimated_time_minutes\": 10,\n      \"welding\": {...},\n      \"safety_warnings\": [\n        \"佩戴安全帽和防护眼镜\",\n        \"确保工件固定牢固\",\n        \"注意防止烫伤\"\n      ]\n    }\n  ]\n}\n```\n\n**⚠️ 重要**：\n- 如果步骤没有安全风险，不要添加safety_warnings字段\n- 如果步骤有安全风险，safety_warnings必须是字符串数组\n- 保持原有步骤的所有字段不变，只添加safety_warnings字段\n\n## 重要提醒\n\n- **只输出JSON，不要输出其他内容**\n- **安全警告要具体**：说明具体的风险和预防措施\n- **使用通俗语言**：工人能看懂的语言\n",
  "user_query": "请为以下装配步骤添加安全警告（如果有安全风险）。\n\n## 装配步骤\n\n[\n  {\n    \"step_number\": 1,\n    \"title\": \"安装侧连接板\",\n    \"parts_used\": [\n      {\n        \"bom_code\": \"01.01.01.11513\",\n        \"bom_name\": \"侧连接板\",\n        \"quantity\": 2,\n        \"mesh_id\": [\n          \"mesh_014\",\n          \"mesh_015\"\n        ]\n      }\n    ],\n    \"tools_required\": [\n      \"焊接工装平台\",\n      \"焊机\"\n    ],\n    \"operation\": \"将两块侧连接板（01.01.01.11513）分别放置在基准件连接板（01.01.11509，图纸中序号1）的两侧，确保侧板与连接板的相对位置和垂直度符合图纸要求。进行点焊定位。\",\n    \"quality_check\": \"检查侧连接板与基准板的垂直度，确保误差小于0.5mm。检查点焊位置是否牢固。\",\n    \"estimated_time_minutes\": 8,\n    \"welding\": {\n      \"required\": true,\n      \"welding_type\": \"点焊定位\",\n      \"welding_method\": \"CO2气保焊\",\n      \"weld_size\": \"点焊长度10mm，焊脚高度4mm\",\n      \"welding_position\": \"侧连接板与基准连接板的垂直接缝处\",\n      \"quality_requirements\": \"点焊牢固，能承受后续装配应力，无虚焊\",\n      \"safety_notes\": \"佩戴防护眼镜和手套，确保工作区域无易燃物\"\n    }\n  },\n  {\n    \"step_number\": 2,\n    \"title\": \"安装上连接板和折弯板\",\n    \"parts_used\": [\n      {\n        \"bom_code\": \"01.01.01.11512\",\n        \"bom_name\": \"上连接板\",\n        \"quantity\": 2,\n        \"mesh_id\": [\n          \"mesh_016\",\n          \"mesh_017\"\n        ]\n      },\n      {\n        \"bom_code\": \"01.01.01.11514\",\n        \"bom_name\": \"折弯板\",\n        \"quantity\": 1,\n        \"mesh_id\": [\n          \"mesh_013\"\n        ]\n      }\n    ],\n    \"tools_required\": [\n      \"焊机\",\n      \"直角尺\"\n    ],\n    \"operation\": \"将两块上连接板（01.01.01.11512）和一块折弯板（01.01.01.11514）安装到已定位的侧连接板上方，形成组件的上部结构。确保所有板件的接缝紧密，并进行点焊定位。\",\n    \"quality_check\": \"检查上连接板与侧连接板的平面度，确保无明显错位。检查折弯板与侧板的连接角度。\",\n    \"estimated_time_minutes\": 10,\n    \"welding\": {\n      \"required\": true,\n      \"welding_type\": \"点焊定位\",\n      \"welding_method\": \"CO2气保焊\",\n      \"weld_size\": \"点焊长度10mm，焊脚高度4mm\",\n      \"welding_position\": \"上连接板与侧连接板的接缝处，折弯板与侧连接板的接缝处\",\n      \"quality_requirements\": \"点焊位置均匀分布，保证结构稳定，防止后续焊接时板件移位\",\n      \"safety_notes\": \"注意防止高空坠物，焊接时保持姿势稳定\"\n    }\n  },\n  {\n    \"step_number\": 3,\n    \"title\": \"安装油缸固定板\",\n    \"parts_used\": [\n      {\n        \"bom_code\": \"01.01.01.11515\",\n        \"bom_name\": \"油缸固定板\",\n        \"quantity\": 4,\n        \"mesh_id\": [\n          \"mesh_002\",\n          \"mesh_003\",\n          \"mesh_011\",\n          \"mesh_012\"\n        ]\n      }\n    ],\n    \"tools_required\": [\n      \"焊机\",\n      \"卡尺\"\n    ],\n    \"operation\": \"将四块油缸固定板（01.01.01.11515）安装到侧连接板的指定位置（通常是侧板外部或内部的加强筋位置）。注意油缸固定板的孔位方向，确保其与图纸上的孔位方向一致。进行点焊定位。\",\n    \"quality_check\": \"检查油缸固定板的安装位置和孔位中心距，确保符合图纸尺寸要求。\",\n    \"estimated_time_minutes\": 7,\n    \"welding\": {\n      \"required\": true,\n      \"welding_type\": \"点焊定位\",\n      \"welding_method\": \"CO2气保焊\",\n      \"weld_size\": \"点焊长度15mm，焊脚高度5mm\",\n      \"welding_position\": \"油缸固定板与侧连接板的四个角\",\n      \"quality_requirements\": \"定位准确，点焊位置不能影响后续的连续焊缝，确保油缸板受力均匀\",\n      \"safety_notes\": \"油缸板较重，定位时注意夹紧，防止砸伤\"\n    }\n  },\n  {\n    \"step_number\": 4,\n    \"title\": \"安装加强板和角钢\",\n    \"parts_used\": [\n      {\n        \"bom_code\": \"01.01.01.11516\",\n        \"bom_name\": \"加强板\",\n        \"quantity\": 4,\n        \"mesh_id\": [\n          \"mesh_007\",\n          \"mesh_008\",\n          \"mesh_009\",\n          \"mesh_010\"\n        ]\n      },\n      {\n        \"bom_code\": \"01.01.04.0592\",\n        \"bom_name\": \"角钢-机加\",\n        \"quantity\": 1,\n        \"mesh_id\": [\n          \"mesh_006\"\n        ]\n      }\n    ],\n    \"tools_required\": [\n      \"焊机\"\n    ],\n    \"operation\": \"将四块加强板（01.01.01.11516）和一块角钢-机加（01.01.04.0592）安装到组件内部或外部的指定加强位置，以增强结构刚性。确保加强板与主体结构紧密贴合。进行点焊定位。\",\n    \"quality_check\": \"检查所有加强件是否与主体结构完全贴合，无间隙。检查角钢的定位是否准确。\",\n    \"estimated_time_minutes\": 12,\n    \"welding\": {\n      \"required\": true,\n      \"welding_type\": \"点焊定位\",\n      \"welding_method\": \"CO2气保焊\",\n      \"weld_size\": \"点焊长度10mm，焊脚高度4mm\",\n      \"welding_position\": \"加强板与侧板的接缝处，角钢与基准板的接缝处\",\n      \"quality_requirements\": \"点焊要牢固，特别是角钢，要保证其受力方向的稳定性\",\n      \"safety_notes\": \"加强板和角钢可能存在尖锐边缘，操作时戴好防护手套\"\n    }\n  },\n  {\n    \"step_number\": 5,\n    \"title\": \"安装方形板和轴套\",\n    \"parts_used\": [\n      {\n        \"bom_code\": \"01.01.01.11511\",\n        \"bom_name\": \"方形板-机加\",\n        \"quantity\": 1,\n        \"mesh_id\": [\n          \"mesh_018\"\n        ]\n      },\n      {\n        \"bom_code\": \"01.01.02.1221\",\n        \"bom_name\": \"轴套\",\n        \"quantity\": 1,\n        \"mesh_id\": [\n          \"mesh_005\"\n        ]\n      }\n    ],\n    \"tools_required\": [\n      \"焊机\",\n      \"游标卡尺\"\n    ],\n    \"operation\": \"将方形板-机加（01.01.01.11511）安装到组件的指定位置。将轴套（01.01.02.1221）插入到方形板或侧板的预留孔位中，确保轴套与孔位配合紧密。进行点焊定位。\",\n    \"quality_check\": \"检查轴套是否完全插入到位，且轴线方向与图纸要求一致。检查方形板的定位尺寸。\",\n    \"estimated_time_minutes\": 9,\n    \"welding\": {\n      \"required\": true,\n      \"welding_type\": \"点焊定位\",\n      \"welding_method\": \"CO2气保焊\",\n      \"weld_size\": \"轴套与板件的圆周上均匀点焊3点，焊脚高度3mm\",\n      \"welding_position\": \"轴套与板件的圆周接缝处\",\n      \"quality_requirements\": \"轴套定位是关键，点焊时要轻，防止热变形影响轴套的同轴度\",\n      \"safety_notes\": \"轴套是精密件，焊接前要确保表面清洁，防止油污燃烧\"\n    }\n  },\n  {\n    \"step_number\": 6,\n    \"title\": \"安装后座轴套\",\n    \"parts_used\": [\n      {\n        \"bom_code\": \"01.01.02.0337\",\n        \"bom_name\": \"后座轴套 1\",\n        \"quantity\": 0,\n        \"mesh_id\": [\n          \"mesh_001\"\n        ]\n      },\n      {\n        \"bom_code\": \"01.02.02.0490\",\n        \"bom_name\": \"后座轴套 1\",\n        \"quantity\": 0,\n        \"mesh_id\": [\n          \"mesh_004\"\n        ]\n      }\n    ],\n    \"tools_required\": [\n      \"焊机\",\n      \"同轴度检测工具\"\n    ],\n    \"operation\": \"将两个后座轴套（01.01.02.0337 和 01.02.02.0490）安装到组件的后部连接位置。注意：这两个轴套是关键配合件，安装时必须使用专用工装夹具，确保两个轴套的轴线同轴度符合图纸要求（图纸要求保证焊接同轴度）。进行点焊定位。\",\n    \"quality_check\": \"使用塞规或专用量具检查两个后座轴套的同轴度，确保在公差范围内。检查轴套端面与板件的焊接间隙。\",\n    \"estimated_time_minutes\": 15,\n    \"welding\": {\n      \"required\": true,\n      \"welding_type\": \"点焊定位（关键尺寸）\",\n      \"welding_method\": \"CO2气保焊\",\n      \"weld_size\": \"轴套与板件的圆周上均匀点焊4点，焊脚高度3mm\",\n      \"welding_position\": \"两个后座轴套与主体板件的圆周接缝处\",\n      \"quality_requirements\": \"必须在专用工装夹具的约束下进行点焊，点焊后立即复检同轴度，确保热输入最小化，防止变形\",\n      \"safety_notes\": \"轴套是关键件，焊接时要使用低电流，慢速点焊，避免烧穿或大面积热变形\"\n    }\n  },\n  {\n    \"step_number\": 7,\n    \"title\": \"整体焊接和清理\",\n    \"parts_used\": [],\n    \"tools_required\": [\n      \"焊机\",\n      \"焊渣锤\",\n      \"角磨机\"\n    ],\n    \"operation\": \"对所有已点焊定位的零件进行全面焊接。焊接时遵循先内后外、先短后长的原则，避免结构变形。焊接完成后，使用焊渣锤和角磨机清理所有焊渣和飞溅物，确保焊缝美观、平整。\",\n    \"quality_check\": \"检查所有焊缝是否饱满、连续，无漏焊、夹渣、气孔等缺陷。检查组件整体尺寸和平面度，确保无明显热变形。\",\n    \"estimated_time_minutes\": 25,\n    \"welding\": {\n      \"required\": true,\n      \"welding_type\": \"连续角焊和对接焊\",\n      \"welding_method\": \"CO2气保焊\",\n      \"weld_size\": \"结构主焊缝焊脚高度6mm，加强板焊缝焊脚高度4mm\",\n      \"welding_position\": \"所有零件之间的接缝（包括侧板、上板、加强板、油缸固定板和轴套）\",\n      \"quality_requirements\": \"焊缝必须连续、饱满，不允许有咬边、裂纹。轴套周围的焊缝要均匀，确保应力分布平衡。焊后要进行外观检查和尺寸复核。\",\n      \"safety_notes\": \"进行大面积焊接时，必须佩戴全套防护装备（面罩、防火服、手套）。确保工作区域通风良好，防止烟尘中毒。焊接完成后，高温部件要设置警示标志。\"\n    }\n  }\n]\n\n## 要求\n\n1. **识别风险步骤**：判断哪些步骤有安全风险（吊装、焊接、高空作业、重物搬运等）\n2. **添加安全警告**：为有风险的步骤添加safety_warnings字段\n3. **保持原有字段**：不要修改或删除原有的字段（step_number、title、welding等）\n4. **使用通俗语言**：工人能看懂的语言\n5. **警告要具体**：说明具体的风险和预防措施\n\n## 自检清单\n\n- [ ] 所有有风险的步骤都添加了safety_warnings字段\n- [ ] safety_warnings是字符串数组，每条警告简洁明了\n- [ ] 原有步骤的所有字段都保持不变\n- [ ] 没有风险的步骤没有添加safety_warnings字段\n\n现在开始为装配步骤添加安全警告！\n",
  "raw_response": "```json\n{\n  \"enhanced_steps\": [\n    {\n      \"step_number\": 1,\n      \"title\": \"安装侧连接板\",\n      \"parts_used\": [\n        {\n          \"bom_code\": \"01.01.01.11513\",\n          \"bom_name\": \"侧连接板\",\n          \"quantity\": 2,\n          \"mesh_id\": [\n            \"mesh_014\",\n            \"mesh_015\"\n          ]\n        }\n      ],\n      \"tools_required\": [\n        \"焊接工装平台\",\n        \"焊机\"\n      ],\n      \"operation\": \"将两块侧连接板（01.01.01.11513）分别放置在基准件连接板（01.01.11509，图纸中序号1）的两侧，确保侧板与连接板的相对位置和垂直度符合图纸要求。进行点焊定位。\",\n      \"quality_check\": \"检查侧连接板与基准板的垂直度，确保误差小于0.5mm。检查点焊位置是否牢固。\",\n      \"estimated_time_minutes\": 8,\n      \"welding\": {\n        \"required\": true,\n        \"welding_type\": \"点焊定位\",\n        \"welding_method\": \"CO2气保焊\",\n        \"weld_size\": \"点焊长度10mm，焊脚高度4mm\",\n        \"welding_position\": \"侧连接板与基准连接板的垂直接缝处\",\n        \"quality_requirements\": \"点焊牢固，能承受后续装配应力，无虚焊\",\n        \"safety_notes\": \"佩戴防护眼镜和手套，确保工作区域无易燃物\"\n      },\n      \"safety_warnings\": [\n        \"进行焊接作业时，必须佩戴焊接面罩、防护手套和防火服，防止电弧光伤害和烫伤。\",\n        \"确保工件在工装平台上夹紧牢固，防止点焊时工件倾倒或移动伤人。\",\n        \"工作区域必须保持通风，避免吸入焊接烟尘。\"\n      ]\n    },\n    {\n      \"step_number\": 2,\n      \"title\": \"安装上连接板和折弯板\",\n      \"parts_used\": [\n        {\n          \"bom_code\": \"01.01.01.11512\",\n          \"bom_name\": \"上连接板\",\n          \"quantity\": 2,\n          \"mesh_id\": [\n            \"mesh_016\",\n            \"mesh_017\"\n          ]\n        },\n        {\n          \"bom_code\": \"01.01.01.11514\",\n          \"bom_name\": \"折弯板\",\n          \"quantity\": 1,\n          \"mesh_id\": [\n            \"mesh_013\"\n          ]\n        }\n      ],\n      \"tools_required\": [\n        \"焊机\",\n        \"直角尺\"\n      ],\n      \"operation\": \"将两块上连接板（01.01.01.11512）和一块折弯板（01.01.01.11514）安装到已定位的侧连接板上方，形成组件的上部结构。确保所有板件的接缝紧密，并进行点焊定位。\",\n      \"quality_check\": \"检查上连接板与侧连接板的平面度，确保无明显错位。检查折弯板与侧板的连接角度。\",\n      \"estimated_time_minutes\": 10,\n      \"welding\": {\n        \"required\": true,\n        \"welding_type\": \"点焊定位\",\n        \"welding_method\": \"CO2气保焊\",\n        \"weld_size\": \"点焊长度10mm，焊脚高度4mm\",\n        \"welding_position\": \"上连接板与侧连接板的接缝处，折弯板与侧连接板的接缝处\",\n        \"quality_requirements\": \"点焊位置均匀分布，保证结构稳定，防止后续焊接时板件移位\",\n        \"safety_notes\": \"注意防止高空坠物，焊接时保持姿势稳定\"\n      },\n      \"safety_warnings\": [\n        \"安装上部板件时，注意板件边缘锋利，操作时务必戴好防割手套。\",\n        \"点焊时，确保上方板件已用夹具固定，防止板件掉落砸伤下方人员。\",\n        \"焊接作业必须佩戴全套防护用品，防止电弧光和高温飞溅物伤害。\"\n      ]\n    },\n    {\n      \"step_number\": 3,\n      \"title\": \"安装油缸固定板\",\n      \"parts_used\": [\n        {\n          \"bom_code\": \"01.01.01.11515\",\n          \"bom_name\": \"油缸固定板\",\n          \"quantity\": 4,\n          \"mesh_id\": [\n            \"mesh_002\",\n            \"mesh_003\",\n            \"mesh_011\",\n            \"mesh_012\"\n          ]\n        }\n      ],\n      \"tools_required\": [\n        \"焊机\",\n        \"卡尺\"\n      ],\n      \"operation\": \"将四块油缸固定板（01.01.01.11515）安装到侧连接板的指定位置（通常是侧板外部或内部的加强筋位置）。注意油缸固定板的孔位方向，确保其与图纸上的孔位方向一致。进行点焊定位。\",\n      \"quality_check\": \"检查油缸固定板的安装位置和孔位中心距，确保符合图纸尺寸要求。\",\n      \"estimated_time_minutes\": 7,\n      \"welding\": {\n        \"required\": true,\n        \"welding_type\": \"点焊定位\",\n        \"welding_method\": \"CO2气保焊\",\n        \"weld_size\": \"点焊长度15mm，焊脚高度5mm\",\n        \"welding_position\": \"油缸固定板与侧连接板的四个角\",\n        \"quality_requirements\": \"定位准确，点焊位置不能影响后续的连续焊缝，确保油缸板受力均匀\",\n        \"safety_notes\": \"油缸板较重，定位时注意夹紧，防止砸伤\"\n      },\n      \"safety_warnings\": [\n        \"油缸固定板可能较重，搬运和定位时注意使用正确的姿势或辅助工具，防止扭伤或砸伤脚部。\",\n        \"定位时必须使用夹具将油缸板夹紧，防止在点焊过程中因重力或应力导致工件脱落。\",\n        \"焊接时注意飞溅物，确保周围没有易燃物。\"\n      ]\n    },\n    {\n      \"step_number\": 4,\n      \"title\": \"安装加强板和角钢\",\n      \"parts_used\": [\n        {\n          \"bom_code\": \"01.01.01.11516\",\n          \"bom_name\": \"加强板\",\n          \"quantity\": 4,\n          \"mesh_id\": [\n            \"mesh_007\",\n            \"mesh_008\",\n            \"mesh_009\",\n            \"mesh_010\"\n          ]\n        },\n        {\n          \"bom_code\": \"01.01.04.0592\",\n          \"bom_name\": \"角钢-机加\",\n          \"quantity\": 1,\n          \"mesh_id\": [\n            \"mesh_006\"\n          ]\n        }\n      ],\n      \"tools_required\": [\n        \"焊机\"\n      ],\n      \"operation\": \"将四块加强板（01.01.01.11516）和一块角钢-机加（01.01.04.0592）安装到组件内部或外部的指定加强位置，以增强结构刚性。确保加强板与主体结构紧密贴合。进行点焊定位。\",\n      \"quality_check\": \"检查所有加强件是否与主体结构完全贴合，无间隙。检查角钢的定位是否准确。\",\n      \"estimated_time_minutes\": 12,\n      \"welding\": {\n        \"required\": true,\n        \"welding_type\": \"点焊定位\",\n        \"welding_method\": \"CO2气保焊\",\n        \"weld_size\": \"点焊长度10mm，焊脚高度4mm\",\n        \"welding_position\": \"加强板与侧板的接缝处，角钢与基准板的接缝处\",\n        \"quality_requirements\": \"点焊要牢固，特别是角钢，要保证其受力方向的稳定性\",\n        \"safety_notes\": \"加强板和角钢可能存在尖锐边缘，操作时戴好防护手套\"\n      },\n      \"safety_warnings\": [\n        \"加强板和角钢的边缘和尖角可能非常锋利，操作和搬运时必须佩戴防割手套，防止割伤。\",\n        \"在组件内部进行点焊时，注意空间狭小，防止身体部位接触高温工件或焊枪。\",\n        \"焊接时注意通风，避免烟尘在密闭空间内积聚。\"\n      ]\n    },\n    {\n      \"step_number\": 5,\n      \"title\": \"安装方形板和轴套\",\n      \"parts_used\": [\n        {\n          \"bom_code\": \"01.01.01.11511\",\n          \"bom_name\": \"方形板-机加\",\n          \"quantity\": 1,\n          \"mesh_id\": [\n            \"mesh_018\"\n          ]\n        },\n        {\n          \"bom_code\": \"01.01.02.1221\",\n          \"bom_name\": \"轴套\",\n          \"quantity\": 1,\n          \"mesh_id\": [\n            \"mesh_005\"\n          ]\n        }\n      ],\n      \"tools_required\": [\n        \"焊机\",\n        \"游标卡尺\"\n      ],\n      \"operation\": \"将方形板-机加（01.01.01.11511）安装到组件的指定位置。将轴套（01.01.02.1221）插入到方形板或侧板的预留孔位中，确保轴套与孔位配合紧密。进行点焊定位。\",\n      \"quality_check\": \"检查轴套是否完全插入到位，且轴线方向与图纸要求一致。检查方形板的定位尺寸。\",\n      \"estimated_time_minutes\": 9,\n      \"welding\": {\n        \"required\": true,\n        \"welding_type\": \"点焊定位\",\n        \"welding_method\": \"CO2气保焊\",\n        \"weld_size\": \"轴套与板件的圆周上均匀点焊3点，焊脚高度3mm\",\n        \"welding_position\": \"轴套与板件的圆周接缝处\",\n        \"quality_requirements\": \"轴套定位是关键，点焊时要轻，防止热变形影响轴套的同轴度\",\n        \"safety_notes\": \"轴套是精密件，焊接前要确保表面清洁，防止油污燃烧\"\n      },\n      \"safety_warnings\": [\n        \"轴套和方形板在定位时需要精确配合，操作时避免用力过猛导致工件损坏或手指夹伤。\",\n        \"焊接轴套时，由于是精密配合件，热输入可能导致变形，必须使用低电流和短时间点焊，防止烧穿或变形。\",\n        \"焊接前必须清理轴套和板件表面的油污，防止焊接时油污燃烧产生有毒烟雾。\"\n      ]\n    },\n    {\n      \"step_number\": 6,\n      \"title\": \"安装后座轴套\",\n      \"parts_used\": [\n        {\n          \"bom_code\": \"01.01.02.0337\",\n          \"bom_name\": \"后座轴套 1\",\n          \"quantity\": 0,\n          \"mesh_id\": [\n            \"mesh_001\"\n          ]\n        },\n        {\n          \"bom_code\": \"01.02.02.0490\",\n          \"bom_name\": \"后座轴套 1\",\n          \"quantity\": 0,\n          \"mesh_id\": [\n            \"mesh_004\"\n          ]\n        }\n      ],\n      \"tools_required\": [\n        \"焊机\",\n        \"同轴度检测工具\"\n      ],\n      \"operation\": \"将两个后座轴套（01.01.02.0337 和 01.02.02.0490）安装到组件的后部连接位置。注意：这两个轴套是关键配合件，安装时必须使用专用工装夹具，确保两个轴套的轴线同轴度符合图纸要求（图纸要求保证焊接同轴度）。进行点焊定位。\",\n      \"quality_check\": \"使用塞规或专用量具检查两个后座轴套的同轴度，确保在公差范围内。检查轴套端面与板件的焊接间隙。\",\n      \"estimated_time_minutes\": 15,\n      \"welding\": {\n        \"required\": true,\n        \"welding_type\": \"点焊定位（关键尺寸）\",\n        \"welding_method\": \"CO2气保焊\",\n        \"weld_size\": \"轴套与板件的圆周上均匀点焊4点，焊脚高度3mm\",\n        \"welding_position\": \"两个后座轴套与主体板件的圆周接缝处\",\n        \"quality_requirements\": \"必须在专用工装夹具的约束下进行点焊，点焊后立即复检同轴度，确保热输入最小化，防止变形\",\n        \"safety_notes\": \"轴套是关键件，焊接时要使用低电流，慢速点焊，避免烧穿或大面积热变形\"\n      },\n      \"safety_warnings\": [\n        \"安装关键轴套时，必须使用专用工装夹具，确保夹具牢固可靠，防止轴套在焊接过程中移位或弹出。\",\n        \"点焊关键尺寸件时，必须严格控制焊接电流和时间，防止因热变形导致轴套同轴度超差，造成返工。\",\n        \"操作专用工装时，注意夹紧和松开动作，避免夹具反弹伤人。\"\n      ]\n    },\n    {\n      \"step_number\": 7,\n      \"title\": \"整体焊接和清理\",\n      \"parts_used\": [],\n      \"tools_required\": [\n        \"焊机\",\n        \"焊渣锤\",\n        \"角磨机\"\n      ],\n      \"operation\": \"对所有已点焊定位的零件进行全面焊接。焊接时遵循先内后外、先短后长的原则，避免结构变形。焊接完成后，使用焊渣锤和角磨机清理所有焊渣和飞溅物，确保焊缝美观、平整。\",\n      \"quality_check\": \"检查所有焊缝是否饱满、连续，无漏焊、夹渣、气孔等缺陷。检查组件整体尺寸和平面度，确保无明显热变形。\",\n      \"estimated_time_minutes\": 25,\n      \"welding\": {\n        \"required\": true,\n        \"welding_type\": \"连续角焊和对接焊\",\n        \"welding_method\": \"CO2气保焊\",\n        \"weld_size\": \"结构主焊缝焊脚高度6mm，加强板焊缝焊脚高度4mm\",\n        \"welding_position\": \"所有零件之间的接缝（包括侧板、上板、加强板、油缸固定板和轴套）\",\n        \"quality_requirements\": \"焊缝必须连续、饱满，不允许有咬边、裂纹。轴套周围的焊缝要均匀，确保应力分布平衡。焊后要进行外观检查和尺寸复核。\",\n        \"safety_notes\": \"进行大面积焊接时，必须佩戴全套防护装备（面罩、防火服、手套）。确保工作区域通风良好，防止烟尘中毒。焊接完成后，高温部件要设置警示标志。\"\n      },\n      \"safety_warnings\": [\n        \"进行连续焊接时，必须佩戴全套防护装备（焊接面罩、防火服、绝缘手套），防止大面积烧伤和电击。\",\n        \"使用角磨机清理焊渣和飞溅物时，必须佩戴防护眼镜和面罩，防止高速飞溅的金属碎屑伤眼。\",\n        \"使用角磨机时，检查磨片是否安装牢固，操作时双手握紧，防止磨片破碎或机器失控伤人。\",\n        \"焊接完成后，工件温度很高，必须设置高温警示标志，并等待自然冷却，严禁徒手触摸，防止烫伤。\"\n      ]\n    }\n  ]\n}\n```",
  "parsed_result": {
    "enhanced_steps": [
      {
        "step_number": 1,
        "title": "安装侧连接板",
        "parts_used": [
          {
            "bom_code": "01.01.01.11513",
            "bom_name": "侧连接板",
            "quantity": 2,
            "mesh_id": [
              "mesh_014",
              "mesh_015"
            ]
          }
        ],
        "tools_required": [
          "焊接工装平台",
          "焊机"
        ],
        "operation": "将两块侧连接板（01.01.01.11513）分别放置在基准件连接板（01.01.11509，图纸中序号1）的两侧，确保侧板与连接板的相对位置和垂直度符合图纸要求。进行点焊定位。",
        "quality_check": "检查侧连接板与基准板的垂直度，确保误差小于0.5mm。检查点焊位置是否牢固。",
        "estimated_time_minutes": 8,
        "welding": {
          "required": true,
          "welding_type": "点焊定位",
          "welding_method": "CO2气保焊",
          "weld_size": "点焊长度10mm，焊脚高度4mm",
          "welding_position": "侧连接板与基准连接板的垂直接缝处",
          "quality_requirements": "点焊牢固，能承受后续装配应力，无虚焊",
          "safety_notes": "佩戴防护眼镜和手套，确保工作区域无易燃物"
        },
        "safety_warnings": [
          "进行焊接作业时，必须佩戴焊接面罩、防护手套和防火服，防止电弧光伤害和烫伤。",
          "确保工件在工装平台上夹紧牢固，防止点焊时工件倾倒或移动伤人。",
          "工作区域必须保持通风，避免吸入焊接烟尘。"
        ]
      },
      {
        "step_number": 2,
        "title": "安装上连接板和折弯板",
        "parts_used": [
          {
            "bom_code": "01.01.01.11512",
            "bom_name": "上连接板",
            "quantity": 2,
            "mesh_id": [
              "mesh_016",
              "mesh_017"
            ]
          },
          {
            "bom_code": "01.01.01.11514",
            "bom_name": "折弯板",
            "quantity": 1,
            "mesh_id": [
              "mesh_013"
            ]
          }
        ],
        "tools_required": [
          "焊机",
          "直角尺"
        ],
        "operation": "将两块上连接板（01.01.01.11512）和一块折弯板（01.01.01.11514）安装到已定位的侧连接板上方，形成组件的上部结构。确保所有板件的接缝紧密，并进行点焊定位。",
        "quality_check": "检查上连接板与侧连接板的平面度，确保无明显错位。检查折弯板与侧板的连接角度。",
        "estimated_time_minutes": 10,
        "welding": {
          "required": true,
          "welding_type": "点焊定位",
          "welding_method": "CO2气保焊",
          "weld_size": "点焊长度10mm，焊脚高度4mm",
          "welding_position": "上连接板与侧连接板的接缝处，折弯板与侧连接板的接缝处",
          "quality_requirements": "点焊位置均匀分布，保证结构稳定，防止后续焊接时板件移位",
          "safety_notes": "注意防止高空坠物，焊接时保持姿势稳定"
        },
        "safety_warnings": [
          "安装上部板件时，注意板件边缘锋利，操作时务必戴好防割手套。",
          "点焊时，确保上方板件已用夹具固定，防止板件掉落砸伤下方人员。",
          "焊接作业必须佩戴全套防护用品，防止电弧光和高温飞溅物伤害。"
        ]
      },
      {
        "step_number": 3,
        "title": "安装油缸固定板",
        "parts_used": [
          {
            "bom_code": "01.01.01.11515",
            "bom_name": "油缸固定板",
            "quantity": 4,
            "mesh_id": [
              "mesh_002",
              "mesh_003",
              "mesh_011",
              "mesh_012"
            ]
          }
        ],
        "tools_required": [
          "焊机",
          "卡尺"
        ],
        "operation": "将四块油缸固定板（01.01.01.11515）安装到侧连接板的指定位置（通常是侧板外部或内部的加强筋位置）。注意油缸固定板的孔位方向，确保其与图纸上的孔位方向一致。进行点焊定位。",
        "quality_check": "检查油缸固定板的安装位置和孔位中心距，确保符合图纸尺寸要求。",
        "estimated_time_minutes": 7,
        "welding": {
          "required": true,
          "welding_type": "点焊定位",
          "welding_method": "CO2气保焊",
          "weld_size": "点焊长度15mm，焊脚高度5mm",
          "welding_position": "油缸固定板与侧连接板的四个角",
          "quality_requirements": "定位准确，点焊位置不能影响后续的连续焊缝，确保油缸板受力均匀",
          "safety_notes": "油缸板较重，定位时注意夹紧，防止砸伤"
        },
        "safety_warnings": [
          "油缸固定板可能较重，搬运和定位时注意使用正确的姿势或辅助工具，防止扭伤或砸伤脚部。",
          "定位时必须使用夹具将油缸板夹紧，防止在点焊过程中因重力或应力导致工件脱落。",
          "焊接时注意飞溅物，确保周围没有易燃物。"
        ]
      },
      {
        "step_number": 4,
        "title": "安装加强板和角钢",
        "parts_used": [
          {
            "bom_code": "01.01.01.11516",
            "bom_name": "加强板",
            "quantity": 4,
            "mesh_id": [
              "mesh_007",
              "mesh_008",
              "mesh_009",
              "mesh_010"
            ]
          },
          {
            "bom_code": "01.01.04.0592",
            "bom_name": "角钢-机加",
            "quantity": 1,
            "mesh_id": [
              "mesh_006"
            ]
          }
        ],
        "tools_required": [
          "焊机"
        ],
        "operation": "将四块加强板（01.01.01.11516）和一块角钢-机加（01.01.04.0592）安装到组件内部或外部的指定加强位置，以增强结构刚性。确保加强板与主体结构紧密贴合。进行点焊定位。",
        "quality_check": "检查所有加强件是否与主体结构完全贴合，无间隙。检查角钢的定位是否准确。",
        "estimated_time_minutes": 12,
        "welding": {
          "required": true,
          "welding_type": "点焊定位",
          "welding_method": "CO2气保焊",
          "weld_size": "点焊长度10mm，焊脚高度4mm",
          "welding_position": "加强板与侧板的接缝处，角钢与基准板的接缝处",
          "quality_requirements": "点焊要牢固，特别是角钢，要保证其受力方向的稳定性",
          "safety_notes": "加强板和角钢可能存在尖锐边缘，操作时戴好防护手套"
        },
        "safety_warnings": [
          "加强板和角钢的边缘和尖角可能非常锋利，操作和搬运时必须佩戴防割手套，防止割伤。",
          "在组件内部进行点焊时，注意空间狭小，防止身体部位接触高温工件或焊枪。",
          "焊接时注意通风，避免烟尘在密闭空间内积聚。"
        ]
      },
      {
        "step_number": 5,
        "title": "安装方形板和轴套",
        "parts_used": [
          {
            "bom_code": "01.01.01.11511",
            "bom_name": "方形板-机加",
            "quantity": 1,
            "mesh_id": [
              "mesh_018"
            ]
          },
          {
            "bom_code": "01.01.02.1221",
            "bom_name": "轴套",
            "quantity": 1,
            "mesh_id": [
              "mesh_005"
            ]
          }
        ],
        "tools_required": [
          "焊机",
          "游标卡尺"
        ],
        "operation": "将方形板-机加（01.01.01.11511）安装到组件的指定位置。将轴套（01.01.02.1221）插入到方形板或侧板的预留孔位中，确保轴套与孔位配合紧密。进行点焊定位。",
        "quality_check": "检查轴套是否完全插入到位，且轴线方向与图纸要求一致。检查方形板的定位尺寸。",
        "estimated_time_minutes": 9,
        "welding": {
          "required": true,
          "welding_type": "点焊定位",
          "welding_method": "CO2气保焊",
          "weld_size": "轴套与板件的圆周上均匀点焊3点，焊脚高度3mm",
          "welding_position": "轴套与板件的圆周接缝处",
          "quality_requirements": "轴套定位是关键，点焊时要轻，防止热变形影响轴套的同轴度",
          "safety_notes": "轴套是精密件，焊接前要确保表面清洁，防止油污燃烧"
        },
        "safety_warnings": [
          "轴套和方形板在定位时需要精确配合，操作时避免用力过猛导致工件损坏或手指夹伤。",
          "焊接轴套时，由于是精密配合件，热输入可能导致变形，必须使用低电流和短时间点焊，防止烧穿或变形。",
          "焊接前必须清理轴套和板件表面的油污，防止焊接时油污燃烧产生有毒烟雾。"
        ]
      },
      {
        "step_number": 6,
        "title": "安装后座轴套",
        "parts_used": [
          {
            "bom_code": "01.01.02.0337",
            "bom_name": "后座轴套 1",
            "quantity": 0,
            "mesh_id": [
              "mesh_001"
            ]
          },
          {
            "bom_code": "01.02.02.0490",
            "bom_name": "后座轴套 1",
            "quantity": 0,
            "mesh_id": [
              "mesh_004"
            ]
          }
        ],
        "tools_required": [
          "焊机",
          "同轴度检测工具"
        ],
        "operation": "将两个后座轴套（01.01.02.0337 和 01.02.02.0490）安装到组件的后部连接位置。注意：这两个轴套是关键配合件，安装时必须使用专用工装夹具，确保两个轴套的轴线同轴度符合图纸要求（图纸要求保证焊接同轴度）。进行点焊定位。",
        "quality_check": "使用塞规或专用量具检查两个后座轴套的同轴度，确保在公差范围内。检查轴套端面与板件的焊接间隙。",
        "estimated_time_minutes": 15,
        "welding": {
          "required": true,
          "welding_type": "点焊定位（关键尺寸）",
          "welding_method": "CO2气保焊",
          "weld_size": "轴套与板件的圆周上均匀点焊4点，焊脚高度3mm",
          "welding_position": "两个后座轴套与主体板件的圆周接缝处",
          "quality_requirements": "必须在专用工装夹具的约束下进行点焊，点焊后立即复检同轴度，确保热输入最小化，防止变形",
          "safety_notes": "轴套是关键件，焊接时要使用低电流，慢速点焊，避免烧穿或大面积热变形"
        },
        "safety_warnings": [
          "安装关键轴套时，必须使用专用工装夹具，确保夹具牢固可靠，防止轴套在焊接过程中移位或弹出。",
          "点焊关键尺寸件时，必须严格控制焊接电流和时间，防止因热变形导致轴套同轴度超差，造成返工。",
          "操作专用工装时，注意夹紧和松开动作，避免夹具反弹伤人。"
        ]
      },
      {
        "step_number": 7,
        "title": "整体焊接和清理",
        "parts_used": [],
        "tools_required": [
          "焊机",
          "焊渣锤",
          "角磨机"
        ],
        "operation": "对所有已点焊定位的零件进行全面焊接。焊接时遵循先内后外、先短后长的原则，避免结构变形。焊接完成后，使用焊渣锤和角磨机清理所有焊渣和飞溅物，确保焊缝美观、平整。",
        "quality_check": "检查所有焊缝是否饱满、连续，无漏焊、夹渣、气孔等缺陷。检查组件整体尺寸和平面度，确保无明显热变形。",
        "estimated_time_minutes": 25,
        "welding": {
          "required": true,
          "welding_type": "连续角焊和对接焊",
          "welding_method": "CO2气保焊",
          "weld_size": "结构主焊缝焊脚高度6mm，加强板焊缝焊脚高度4mm",
          "welding_position": "所有零件之间的接缝（包括侧板、上板、加强板、油缸固定板和轴套）",
          "quality_requirements": "焊缝必须连续、饱满，不允许有咬边、裂纹。轴套周围的焊缝要均匀，确保应力分布平衡。焊后要进行外观检查和尺寸复核。",
          "safety_notes": "进行大面积焊接时，必须佩戴全套防护装备（面罩、防火服、手套）。确保工作区域通风良好，防止烟尘中毒。焊接完成后，高温部件要设置警示标志。"
        },
        "safety_warnings": [
          "进行连续焊接时，必须佩戴全套防护装备（焊接面罩、防火服、绝缘手套），防止大面积烧伤和电击。",
          "使用角磨机清理焊渣和飞溅物时，必须佩戴防护眼镜和面罩，防止高速飞溅的金属碎屑伤眼。",
          "使用角磨机时，检查磨片是否安装牢固，操作时双手握紧，防止磨片破碎或机器失控伤人。",
          "焊接完成后，工件温度很高，必须设置高温警示标志，并等待自然冷却，严禁徒手触摸，防止烫伤。"
        ]
      }
    ]
  }
}